{
  "brand": "乐视 / Letv / LeEco",
  "region": "cn",
  "aliases": [
    "乐视",
    "乐视电视",
    "Letv",
    "LETV",
    "LeEco",
    "LETV UI",
    "EUI",
    "EUI TV",
    "乐视超级电视",
    "超级电视",
    "ctv",
    "HiDPT",
    "Cultraview"
  ],
  "status": "适用",
  "summary": "能做：老款EUI机型（Android 4.x-7.x）与新款Android 12巨幕系列（海思+CV560板卡）均能通过信号源菜单输2580呼出工厂菜单开启ADB。新机实测可用disable-user停用12个广告与预装包，且实测可通过修改底层persist属性彻底关闭11MB硬编码开机视频广告（bootvideo.mp4）。",
  "identify_hints": {
    "remote_has_digits": "关键注意点：信号源菜单下按2580必须用数字键输入。老款红外遥控器自带数字键；新款简易蓝牙遥控器若无数字键，可在电视USB口外接一个电脑USB键盘敲数字2580。",
    "system_name_shown_at": "设置 →「系统信息」或「关于本机」；老机型标明 EUI 5.x/6.x，新板卡机型由于系统极简，仅显示设备名称为 AndroidTV、安卓版本 12",
    "about_page_fields": [
      "设备名称（AndroidTV）",
      "安卓版本（12 / 5.x / 6.x）",
      "客户产品（如 Q85_CV560-C75_930MA_Letv_BRT）",
      "板型（如 CV560-C75）",
      "MAC 地址",
      "WIFI MAC 地址"
    ],
    "model_naming_rule": "乐视整机型号以尺寸与系列字母组合，如超3/超4代际（X40/X43/X50/X55/X65、Max 70），近年新机型如 Q85（85英寸巨幕QLED）。在工厂菜单「客户产品」字段可看到精确硬件标识。",
    "sticker_location": "机身背部铭牌印有完整型号与生产批次；工厂菜单顶部也会直接显示准确板型与客户产品型号",
    "year_ranges": "2013-2016 初代/超2/超3（Android 4.x-5.x）；2016-2020 超4/超5/全面屏系列（Android 6.x-7.x）；2021-2024 近代大屏系列（Android 9-12，如本次实测 2024-11 固件 Q85 巨幕）"
  },
  "series": [
    {
      "name": "乐视 Q85 / CV560 板卡系列（Android 12，海思方案）",
      "years": "2021–2024",
      "base_os": "android",
      "android_version_range": "Android 12",
      "models_examples": [
        "乐视超级电视 Q85",
        "CV560-C75 板卡机型"
      ],
      "identify_hints": "设置菜单极简（仅系统信息、系统升级、恢复出厂设置、服务协议四项），系统信息显示设备名称为 AndroidTV、安卓版本 12。在信号源浮窗下按 2580 可呼出工厂菜单，顶部显示客户产品 Q85_CV560-C75_..._Letv_BRT。",
      "worth_it_hint": "收益极大：3GB 运存，实测可用 disable-user 停用 12 个广告与后台冗余组件；更关键的是实测可通过 persist 属性彻底关闭 11MB 底层硬件开机广告视频（bootvideo.mp4），秒进桌面。",
      "entries": [
        {
          "applies_to": "CV560-C75 及同代板卡乐视电视（信号源菜单按 2580）",
          "steps": [
            "开机后在任意界面按遥控器【信号源】键，呼出信号源浮动菜单（注意：停在浮动菜单上，切勿切入全屏信号源）",
            "在信号源浮动菜单弹窗显示时，依次按下数字键「2580」",
            "屏幕左侧弹出蓝底「工厂菜单」",
            "按遥控器【方向下键】进入【其他选项】（若没有则进入【常用选项】）",
            "找到【ADB】或【ADB调试】，将其设置为「开 / ON」",
            "按返回键退出工厂菜单，将电视关机断电，重新通电开机生效",
            "电脑终端执行：adb connect 电视IP:5555"
          ],
          "has_auth_prompt": false,
          "wireless_pairing": false,
          "port": 5555,
          "evidence_level": "本机实测",
          "sources": [
            {
              "url": "https://github.com/sanshengai/sansheng-tv-adb",
              "title": "本机实测乐视 Q85（CV560-C75，2024-11-12 固件，Android 12）",
              "date": "2026-10-20"
            }
          ],
          "verified_by": "本机实测 2026-10-20（乐视超级电视 Q85，CV560-C75 板卡，Android 12）",
          "risk_notes": "只改 ADB 一项。工厂菜单中严禁进入「屏参调整」（会导致花屏/倒屏）和「老化模式」（红绿蓝纯色闪烁锁死）。"
        }
      ],
      "pm_caps": {
        "disable_user": "yes",
        "hide": "no",
        "uninstall_user0": "unknown",
        "notes": "Android 12 原生行为：pm disable-user --user 0 完美可用且可原样还原；pm hide 会报 MANAGE_USERS 权限异常不可用。",
        "evidence_level": "本机实测"
      },
      "must_keep": [
        {
          "pkg": "com.stv.deskplatform",
          "what": "乐视桌面启动器（必须保留，切勿停用）",
          "evidence_level": "本机实测"
        },
        {
          "pkg": "com.cultraview.setting",
          "what": "系统设置菜单",
          "evidence_level": "本机实测"
        },
        {
          "pkg": "android.cultraview.tv.service",
          "what": "Cultraview 电视核心服务（画质/音效/信号通道）",
          "evidence_level": "本机实测"
        },
        {
          "pkg": "com.hisilicon.tv.service",
          "what": "海思芯片底层电视服务",
          "evidence_level": "本机实测"
        },
        {
          "pkg": "com.cultraview.tvboot",
          "what": "系统启动引导组件",
          "evidence_level": "本机实测"
        }
      ],
      "junk": [
        {
          "pkg": "com.stv.bootadmanager",
          "what": "开机广告管理器",
          "evidence_level": "本机实测"
        },
        {
          "pkg": "com.cultraview.retail",
          "what": "卖场演示模式",
          "evidence_level": "本机实测"
        },
        {
          "pkg": "com.cultraview.screensaver",
          "what": "轮播屏保推广",
          "evidence_level": "本机实测"
        },
        {
          "pkg": "com.android.printspooler",
          "what": "打印服务后台",
          "evidence_level": "本机实测"
        },
        {
          "pkg": "com.ctv.autotest.helper",
          "what": "出厂自动测试残留",
          "evidence_level": "本机实测"
        },
        {
          "pkg": "com.le.lepay.tv",
          "what": "乐视电视支付弹窗服务",
          "evidence_level": "本机实测"
        },
        {
          "pkg": "com.letv.tvos.intermodal",
          "what": "乐视联运推广后台",
          "evidence_level": "本机实测"
        },
        {
          "pkg": "com.stv.appdaemon",
          "what": "乐视后台守护进程",
          "evidence_level": "本机实测"
        }
      ],
      "ask_user": [
        {
          "pkg": "com.aispeech.tvui",
          "what": "思必驰语音助手交互界面",
          "evidence_level": "本机实测"
        },
        {
          "pkg": "com.stv.voice",
          "what": "乐视语音核心服务",
          "evidence_level": "本机实测"
        },
        {
          "pkg": "com.letv.lekids",
          "what": "乐视儿童频道（开机易抢占桌面，不看儿童内容建议停用）",
          "evidence_level": "本机实测"
        },
        {
          "pkg": "com.letv.tvos.appstore",
          "what": "乐视自带应用商店",
          "evidence_level": "本机实测"
        }
      ],
      "pitfalls": [
        {
          "what": "信号源按 2580 的触发时机：必须在按信号源键后屏幕浮出信号源菜单列表时输入；如果已经切入 HDMI1 等全屏信号源画面后再按无效。"
        },
        {
          "what": "11MB 底层硬件硬编码开机广告视频：在 /system/product/media/bootvideo.mp4，由底层 init 服务 /system/bin/bootvideo 驱动，仅停用 APK 无法去除。必须通过 ADB 执行 setprop persist.sys.bootvideo.enable false 与 setprop persist.sys.bootanimation.type 0 以及 setprop persist.letv.advertisement false，重启即可彻底消除并切回原生开机动画。"
        },
        {
          "what": "com.letv.lekids 抢占开机桌面：该包注册了 HOME category 过滤器，开机会自动抢占前台拉起 VipHomeActivity。停用后系统桌面自然归位至官方纯净桌面 com.stv.deskplatform。"
        }
      ]
    },
    {
      "name": "经典乐视 EUI 系列（超3 / 超4 / X系列等，Android 4.x–7.x）",
      "years": "2014–2020",
      "base_os": "android",
      "android_version_range": "Android 4.4 – 7.1",
      "models_examples": [
        "乐视超级电视 X40/X43/X50/X55/X65",
        "超3系列",
        "超4系列",
        "Max 70"
      ],
      "identify_hints": "主界面是经典的 EUI 轮播台与九宫格桌面，关于本机中显示 EUI 5.x / 6.x；遥控器通常为九键或经典红外带数字键遥控。",
      "worth_it_hint": "值得做：运存通常仅 1GB–2GB，停用乐视全家桶（轮播台、购物、儿童、应用商店、推送）可释放 300MB+ 运存大幅减少卡顿。早期 Android 4.x 机型受限系统权限停用可能被拒。",
      "entries": [
        {
          "applies_to": "EUI 5.x / 6.x 通用信号源 2580 工厂菜单",
          "steps": [
            "在信号源界面（或信号源菜单弹窗）依次输入数字「2580」",
            "弹出工程菜单后，选择「Other Options」（其他选项）",
            "滚动到底部找到「ADB调试」或「ADB Debug」，设为「ON」",
            "将电视关机断电重启生效",
            "电脑连接：adb connect 电视IP:5555"
          ],
          "has_auth_prompt": false,
          "wireless_pairing": false,
          "port": 5555,
          "evidence_level": "多源",
          "sources": [
            {
              "url": "https://www.znds.com",
              "title": "乐视电视通用工程模式开启 ADB 教程"
            }
          ],
          "risk_notes": "只改 ADB 一项。工厂菜单涉及硬件底层，误改屏参有花屏风险。"
        }
      ],
      "pm_caps": {
        "disable_user": "yes",
        "hide": "unknown",
        "uninstall_user0": "yes"
      },
      "must_keep": [
        {
          "pkg": "com.letv.tv",
          "what": "乐视电视核心框架",
          "evidence_level": "多源",
          "sources": [
            {
              "url": "https://www.znds.com",
              "title": "乐视电视精简核心名单"
            }
          ]
        }
      ],
      "junk": [
        {
          "pkg": "com.letv.ad.service",
          "what": "乐视广告服务",
          "evidence_level": "多源",
          "sources": [
            {
              "url": "https://www.znds.com",
              "title": "乐视电视广告包名"
            }
          ]
        }
      ],
      "ask_user": [
        {
          "pkg": "com.letv.tvos.gamecenter",
          "what": "乐视游戏中心",
          "evidence_level": "多源",
          "sources": [
            {
              "url": "https://www.znds.com",
              "title": "乐视电视游戏中心"
            }
          ]
        }
      ],
      "pitfalls": [
        {
          "what": "Android 4.x 机型停用命令可能被厂商安全策略拒绝，表现为 SecurityException，此类机型连得上但改不了系统预装应用。"
        }
      ]
    }
  ],
  "open_questions": [
    "部分老款 Android 4.x 乐视电视是否存在免 root 禁用系统 APK 的替代命令"
  ],
  "last_reviewed": "2026-10-20"
}