{
  "brand": "荣耀智慧屏",
  "region": "cn",
  "aliases": ["Honor Vision", "HONOR Smart Screen", "荣耀智慧屏 X 系列", "荣耀电视"],
  "status": "不适用",
  "summary": "荣耀官方客服两次公开答复「智慧屏系列产品不支持 ADB 命令」，开发人员选项里只有演示模式一类选项，没有 USB 调试 / ADB / HDC 开关；X1 上曾经出现过的 HDC 开关也在 2024 年的一次系统升级后被下线。网上能搜到的「荣耀智慧屏开 ADB 教程」对应的是升级前的老固件，现在的机器照着做会发现开关根本不存在。好消息是荣耀智慧屏本来就以「开关机无广告」为卖点，不做也损失不大。",
  "identify_hints": {
    "remote_has_digits": "未核实：未找到荣耀官方对智慧屏遥控器按键的说明",
    "system_name_shown_at": "智慧屏主页 → 设置 → 系统 → 关于本机（或「客户服务支持」），可看当前版本信息（荣耀官方手册）",
    "about_page_fields": [
      "系统版本（用户自述形如「鸿蒙 1.0.1」）",
      "设备型号：设置 → 系统 → 关于本机 → 设备型号",
      "序列号 SN：设置 → 系统 → 关于本机 → 序列号"
    ],
    "model_naming_rule": "产品名直接叫「荣耀智慧屏 X1 / X2 / X3 / X3i / 荣耀智慧屏 5」，官网按这个名字分产品页；未找到荣耀官方公布的智慧屏内部型号编码规律",
    "sticker_location": "产品包装上，或智慧屏背面的产品铭牌上（荣耀官方手册明确写了这两处）",
    "year_ranges": "2019-08 荣耀智慧屏 / Pro 首发（当时荣耀仍属华为）→ 2020-11 荣耀独立 → 2021 起 X1/X2/X3/X3i 延续至今，2026 年在售的是荣耀智慧屏 5 与 X3 系列"
  },
  "not_applicable": {
    "reason": "荣耀客服（「荣耀答答团」）在 2024-02-14（X2 提问）与 2024-10-21（X1 提问）两次公开答复：智慧屏系列产品不支持 ADB 命令。用户实测进入【设置 → 系统和更新 → 开发人员选项】后，里面只有演示模式等少数选项，没有 USB 调试 / ADB / HDC 任何一个开关。更关键的是 X1 用户在 2024-03-25 反馈：早期「鸿蒙 1.0.1」固件上原本有【HDC 调试】开关，系统升级之后这个开关直接消失了——也就是说这是厂商主动收掉的能力，不是没找到入口。",
    "alternative": "荣耀智慧屏从首发就主打「开关机无广告」（2019 年发布会宣传口径），系统层面没有开机广告需要关。剩下能做的是这几件，都在遥控器上完成，不需要电脑：① 关掉升级弹窗：设置 → 系统 → 自动更新，按确认键关闭（荣耀官方手册）；② 关个性化推荐：应用市场 → 我的 → 设置 → 内容推荐服务 → 关闭个性化推荐（🔴 这条是荣耀官方针对应用市场写的通用说明，智慧屏端是否同一路径未核实，进去找不到就跳过）；③ 首页那些推荐位/内容卡片有没有关闭开关，没找到任何官方说明，见 open_questions。",
    "sources": [
      {"url": "https://club.honor.com/cn/thread-28369936-1-1.html", "title": "荣耀智慧屏 X2 如何打开 ADB（荣耀答答团官方回复：智慧屏系列产品不支持 ADB 命令）", "date": "2024-02-14"},
      {"url": "https://club.honor.com/cn/thread-28910839-1-1.html", "title": "荣耀智慧屏 X1 为什么开发者选项里找不到 ADB 选项？？？（官方回复同上）", "date": "2024-10-21"},
      {"url": "https://www.honor.com/cn/support/content/zh-cn15812202/", "title": "荣耀官方《系统设置》（适用荣耀智慧屏 X3 / 5 / X2 系列 / X3i 系列 / X1 4G 内存版）：更新系统、关闭自动更新、查看版本与型号、查 SN 的官方路径"},
      {"url": "https://www.honor.com/cn/support/content/zh-cn15852933/", "title": "开启/关闭荣耀应用市场中的自动推荐/个性化推荐（官方，路径：应用市场 > 我的 > 设置 > 内容推荐服务）"},
      {"url": "https://www.pingwest.com/a/191202", "title": "荣耀智慧屏发布：主打「开关机无广告」", "date": "2019-07-16"}
    ]
  },
  "series": [
    {
      "name": "荣耀智慧屏 / 荣耀智慧屏 Pro（首发代，鸿蒙 1.0）",
      "years": "2019-08",
      "base_os": "harmony",
      "android_version_range": "华为未公开；这批机器与同期华为智慧屏同源，底层是 Android/AOSP 分支，2019 年知乎上有过「荣耀电视系统设置里有 ADB 调试」的讨论（原帖正文未抓取成功，只能确认讨论存在）",
      "models_examples": ["荣耀智慧屏 Pro 55 寸（2019-08-10 发布，4799 元）", "荣耀智慧屏（标准版）"],
      "identify_hints": "2019 年买的、带升降 AI 摄像头、开机没有广告、当时宣传语是「不是电视，是电视的未来」；那会儿荣耀还是华为子品牌（2020-11 才独立）",
      "worth_it_hint": "机龄 7 年，硬件确实老；但没有可用的 ADB 入口，卡顿只能靠少装应用和恢复出厂设置缓解",
      "entries": []
    },
    {
      "name": "荣耀智慧屏 X1（含 X1 4G 内存版 2022 款）",
      "years": "2020-2022（2024 年仍在用）",
      "base_os": "harmony",
      "android_version_range": "用户自述固件标注为「鸿蒙 1.0.1」，长期停在早期版本号；荣耀未公开对应的 Android 版本",
      "models_examples": ["荣耀智慧屏 X1", "荣耀智慧屏 X1 4G 内存版（2022 款）"],
      "identify_hints": "关于本机里系统版本显示 1.0.x；官网产品线里单列「荣耀智慧屏 X1 4G 内存版(2022款)」",
      "worth_it_hint": "🔴 连不上：早期固件上那个【HDC 调试】开关已被升级下线，升级后的机器开发人员选项里空空如也。X1 标准版内存偏小，但没有可用的清理通道",
      "entries": [],
      "pitfalls": [
        {
          "what": "🔴 X1 用户 2024-03-25 发帖：「鸿蒙 1.0.1」时期机器上是有【HDC 调试】开关的，升级系统之后开关没有了、adb 也打不开；同一串帖子在 2024-10-21 由荣耀官方回复「智慧屏系列产品不支持 ADB 命令」收尾。所以网上早年的荣耀开 ADB 教程不是假的，只是对应的固件已经被官方升级抹掉了——照着做找不到开关属于正常现象，不是操作失误",
          "sources": [
            {"url": "https://club.honor.com/cn/thread-28480490-1-1.html", "title": "荣耀智慧屏 X1 如何打开 HDC 或者 ADB", "date": "2024-03-25 发帖，2024-10-21 官方回复"}
          ]
        }
      ]
    },
    {
      "name": "荣耀智慧屏 X2 / X3 / X3i / 荣耀智慧屏 5（独立后的 TV 固件）",
      "years": "2021-2026",
      "base_os": "harmony",
      "android_version_range": "荣耀未公开；2020-11 荣耀独立后固件路线与华为智慧屏分道，不能拿华为智慧屏的结论套用",
      "models_examples": ["荣耀智慧屏 X2", "荣耀智慧屏 X3", "荣耀智慧屏 X3i", "荣耀智慧屏 5"],
      "identify_hints": "2021 年以后买的荣耀电视，官网产品页在「智慧屏」分类下；开发人员选项能打开，但里面只有演示模式一类选项",
      "worth_it_hint": "🔴 不用做：没有 ADB 入口；荣耀智慧屏产品线延续「开关机无广告」定位，能关的都在遥控器可达的设置里",
      "entries": []
    }
  ],
  "open_questions": [
    "荣耀智慧屏首页的推荐位 / 内容卡片有没有官方的关闭开关（类似手机端的「个性化推荐」），在荣耀官网智慧屏支持文档里没找到对应条目",
    "应用市场里那条「内容推荐服务 → 关闭个性化推荐」的路径在智慧屏端是否存在（官方文档是按手机端写的，未核实 TV 版）",
    "荣耀客服 2024 年的「智慧屏系列产品不支持 ADB 命令」是针对 X1/X2 的答复，是否覆盖 2019 年首发代和 2025-2026 年的荣耀智慧屏 5，没有覆盖全系的官方文档，只能当强证据",
    "2019 年荣耀还是华为子品牌时首发的荣耀智慧屏/Pro，固件上是否确实支持标准 ADB（知乎原帖正文抓取失败）",
    "荣耀是否提供 ADB/HDC 之外的官方调试或应用管理通道（如荣耀开发者平台的远程真机），未查到文档"
  ],
  "last_reviewed": "2026-09-15"
}
