{
  "brand": "海尔",
  "region": "cn",
  "aliases": ["Haier", "统帅", "Leader", "卡萨帝", "Casarte", "海尔阿里电视", "海尔智慧屏"],
  "status": "部分适用",
  "summary": "先分清是「阿里 YunOS」还是「安卓」——海尔官网每款电视的规格参数页都直写「操作系统」这一栏，比在电视上翻菜单可靠。YunOS 那一批没有可用的 ADB 路线，直接走官方关广告；安卓那一批用「信源键 → 左左上右」进隐藏菜单开 ADB，有三个彼此独立的来源。",
  "identify_hints": {
    "remote_has_digits": "数字键有无都不影响；关键是遥控器上有没有「信源」（输入源 / Source）键——安卓机型的 ADB 入口就是从按这个键开始的",
    "system_name_shown_at": "最可靠的不是电视本身，是 haier.com 上该型号页面的「规格参数 → 操作系统」字段：写「阿里YunOS」就是 YunOS 代，写「安卓系统」就是安卓代。电视端则看桌面长相（见各系列的 identify_hints）",
    "about_page_fields": ["操作系统（海尔官网规格参数页）", "型号", "Android 版本（仅安卓代有）"],
    "model_naming_rule": "老型号是「两个字母 + 尺寸 + 字母数字后缀」：LE 多见于全高清/普通 LED（LE42AL88A51、LE43AL88E81），LS 多见于 4K 超高清（LS65AL88A71、LS50AL88R81A2），LD 是早期模块化机（LD49U9000），LQ 亦见于 4K 机（LQ55AL88M92）。中段 AL88 后面的字母（A/E/M/R/T）大致随代次推进，在官网页面日期上能对上（A71 对 2018、T71 对 2019），但这只是观察到的规律，海尔没有公布对照表，判定年份请以官网该型号页面的发布日期为准。2024 年前后改成短型号：43H5、50A20、Q60D 这类「尺寸 + 单字母 + 数字」。海外/台湾线另用 LE75S8UX2、H65S900UX2 这种带 UX 尾缀的型号，走 Google TV，不在本条目的 cn 范围内。",
    "sticker_location": "机身背面铭牌",
    "year_ranges": "2014 模块化（LD49U9000）；2015-04 海尔阿里Ⅱ代；2016-11 阿里Ⅲ代；2017-09 阿里Ⅳ代。海尔官网 2018-05 的 LS65AL88A71 规格页仍写「阿里YunOS」，2019-10 的 65T75 介绍页仍提 YunOS，所以 YunOS 代至少延续到 2019；官网 2024 年的 43H5、50A20 规格页已写「安卓系统」。2019 到 2024 之间的确切切换年份本轮没查到。"
  },
  "series": [
    {
      "name": "海尔阿里电视（YunOS 代）",
      "years": "约 2014-2019",
      "base_os": "yunos",
      "android_version_range": "不适用——YunOS（阿里云 OS）不是标准 Android TV，没有安卓意义上的开发者选项",
      "models_examples": ["LE42AL88A51", "LE42AL88A71", "LS58AL88A91", "LS65AL88A71", "LS50AL88R81A2", "LQ55AL88M92", "65T75"],
      "identify_hints": "海尔官网该型号规格页的「操作系统」写「阿里YunOS」；电视桌面是 YunOS for TV 的横向卡片/轮播式界面，不是标准安卓电视那种行列式排布；自带商店是阿里数娱体系而非安卓应用商店；型号多为 LE/LS/LQ + AL88 这一串",
      "worth_it_hint": "机龄 6-11 年，而且这一代本来就没有可用的 ADB 通道——花时间开 ADB 的期望收益基本为零。只做两件事：① 按下面 pitfalls 里的官方路径永久关掉开机广告（免费，不碰系统）；② 想装软件看直播就外接一个电视盒子，比折腾系统省事得多。",
      "entries": [],
      "pm_caps": {
        "disable_user": "unknown",
        "hide": "unknown",
        "uninstall_user0": "unknown",
        "notes": "这一代进不去 ADB，pm 命令无从谈起，三项一律 unknown。"
      },
      "must_keep": [],
      "junk": [],
      "ask_user": [],
      "pitfalls": [
        {
          "what": "这一代没有找到任何可用的 ADB 开启路径。网友在知乎的原话是「没有任何办法」，教程类文章一律转向 U 盘侧装或第三方口令码安装工具，全都不经过 ADB。碰到这类机器，不要照搬通用安卓步骤反复试——按不出来是系统就没有，不是操作错了。",
          "sources": [
            {"url": "https://www.zhihu.com/question/327410615", "title": "海尔电视安装不了第三方软件怎么解决？（知乎）", "date": "2019-06-01"},
            {"url": "http://www.shafa.com/methods/haier_27", "title": "海尔YunOS系统安装方法（沙发管家）"},
            {"url": "https://www.znds.com/tv-725055-1-1.html", "title": "海尔电视 yunos 系统最新安装第三方应用看直播教程（ZNDS）"}
          ]
        },
        {
          "what": "替代动作（官方、免费、零风险，YunOS 和安卓机型都适用）：打海尔客服 400-6999999，按提示转投诉人工，说明要去除开机广告；客服会记录信息并派工单，售后 24 小时内回电，给两个选择——① 免费上门去除；② 电话指导：在海尔电视的应用商店搜装「广告助手」App，打开后屏幕上会显示一个 8 位校验码，把机器信息报给官方换取对应的码，输入即可永久去掉开机广告。这个校验码只能从官方拿。",
          "sources": [
            {"url": "https://post.smzdm.com/p/apv2dm7w", "title": "还热乎的去除海尔电视开机广告方法（什么值得买）", "date": "2022-11-04"}
          ]
        },
        {
          "what": "2015 年 11 月阿里 YunOS 因政策调整关停部分服务，大批用户已安装的第三方影视/直播软件一夜被强制卸载且装不回来。这是影响整个 YunOS 阵营（含海尔阿里系）的行业性事件，不是「没开 ADB」造成的，所以也不是开了 ADB 就能解决的。",
          "sources": [
            {"url": "https://mt.sohu.com/20151116/n426605773.shtml", "title": "阿里系列盒子停服风波深度快速恢复软件教程", "date": "2015-11-16"},
            {"url": "https://lmtw.com/mzw/content/detail/id/123617", "title": "深度解析：阿里YunOS停服风波及其前世今生", "date": "2015-11-18"},
            {"url": "https://www.zhihu.com/question/37528010", "title": "如何评价阿里YunOS强制卸载用户已安装的第三方软件？（知乎）", "date": "2015-11-15"}
          ]
        }
      ]
    },
    {
      "name": "海尔安卓电视（非 YunOS）",
      "years": "切换年份未确认；海尔官网 2024 年的机型规格页已写「安卓系统」",
      "base_os": "android",
      "android_version_range": "未确认——海尔官网规格页只写「安卓系统」，不标 Android 版本号",
      "models_examples": ["43H5", "50A20", "Q60D（天悦零添加）"],
      "identify_hints": "海尔官网该型号规格页的「操作系统」写「安卓系统」；遥控器上有「信源」键；桌面是安卓电视式的行列桌面而非 YunOS 的横向卡片轮播；型号多为 2024 年后的短型号（43H5、50A20、Q60D）",
      "worth_it_hint": "机龄 0-5 年、2GB 以上内存的近年机型，精简收益明显（海尔开机广告一直是老用户的主要抱怨点）。一个例外：2026 年海尔自己推的「天悦零添加」Q60D 主打的就是没有开机广告，买这款就不用折腾。",
      "entries": [
        {
          "applies_to": "有「信源」键的海尔安卓机型",
          "steps": [
            "先切到信源界面（按遥控器「信源」/ Source 键，停在信号源选择界面上）",
            "依次按【信源键】【左】【左】【上】【右】",
            "屏幕弹出隐藏菜单",
            "在隐藏菜单里把 ADB / USB 调试置为「开」",
            "电脑与电视连同一个局域网后 adb connect 电视IP:5555"
          ],
          "has_auth_prompt": null,
          "wireless_pairing": null,
          "port": 5555,
          "evidence_level": "多源",
          "sources": [
            {"url": "https://quicktvui.com/zh-CN/guide/device/haier.html", "title": "Haier | QuickTVUI（电视应用开发框架的设备文档：打开 USB 调试教程）"},
            {"url": "https://post.smzdm.com/p/a4qlqmzl", "title": "智能电视隐藏设置：ADB开关这样开，告别卡顿与广告", "date": "2026-03-12"},
            {"url": "https://www.bilibili.com/video/BV1wQzuYqENY/", "title": "海尔电视打开ADB教程！（B站）"},
            {"url": "https://www.bilibili.com/video/BV1GT421i7Wn/", "title": "海尔电视ADB打开方式（B站）"}
          ],
          "risk_notes": "弹出的是隐藏菜单，不是完整工厂菜单——只碰 ADB / USB 调试这一项，菜单里若还有屏参数、老化、总线一类选项一律不动。按键必须依次按完，中途不要按返回或确定；按错没有任何提示，退出信源界面重新进来再按一遍即可，不要连着乱按。端口 5555 是安卓默认值，不是海尔专属证据。"
        },
        {
          "applies_to": "上面那条按不出来时的变体记法",
          "steps": [
            "进入信源界面",
            "依次按【信源键】【左】【左】【右】【右】",
            "在弹出的菜单里打开 ADB 开关"
          ],
          "has_auth_prompt": null,
          "wireless_pairing": null,
          "port": 5555,
          "evidence_level": "单源",
          "sources": [
            {"url": "https://dnew.cc/index.php/archives/209.html", "title": "品牌电视ADB开启方法（异新网）", "date": "2025-12-17"}
          ],
          "risk_notes": "同一个入口的另一种记法，三个来源里有两个写「左左上右」、这一个写「左左右右」，没有本机实测能判定哪个对、是否按机型分。「左左上右」失败时再试这条。"
        }
      ],
      "pm_caps": {
        "disable_user": "unknown",
        "hide": "unknown",
        "uninstall_user0": "unknown",
        "notes": "没有任何海尔专属的 pm disable-user / hide / uninstall --user 0 成功或失败记录，三项一律 unknown。"
      },
      "must_keep": [],
      "junk": [],
      "ask_user": [],
      "pitfalls": [
        {
          "what": "这个隐藏菜单入口不是所有机型都有。2022 年一位值得买作者本来就是打算用 ADB 删广告包的，原话是「海尔电视我半天没找到如何开启开发者选项」，最后改用 App 关广告了事。找不到就走官方关广告路径，别把时间耗在反复按组合键上。",
          "sources": [
            {"url": "https://post.smzdm.com/p/apv2dm7w", "title": "还热乎的去除海尔电视开机广告方法（什么值得买）", "date": "2022-11-04"}
          ]
        },
        {
          "what": "查资料时容易抄错品牌。网上的品牌汇总表常把海尔和 TCL/雷鸟并在同一行（异新网那篇的小标题就写成「TCL/雷鸟/海尔TCL电视/雷鸟电视」），那一段的前半句「打开我的应用→设置→关于本机→本机信息→按上下左右」是 TCL 系的走法，不是海尔的；海尔那句在后半句，起手键是「信源」。",
          "sources": [
            {"url": "https://dnew.cc/index.php/archives/209.html", "title": "品牌电视ADB开启方法（异新网）", "date": "2025-12-17"}
          ]
        },
        {
          "what": "替代动作（官方、免费、零风险）：同 YunOS 代——打 400-6999999 转投诉人工要求去除开机广告，售后上门免费处理，或电话指导装官方「广告助手」App 并由官方提供 8 位校验码。不想开 ADB 的人先做这个。另有网友分享的第三方「冻结开机广告」App（U 盘或当贝市场推送安装，打开点一下即可），但这是单一网友来源，不如官方路径可靠。",
          "sources": [
            {"url": "https://post.smzdm.com/p/apv2dm7w", "title": "还热乎的去除海尔电视开机广告方法（什么值得买）", "date": "2022-11-04"}
          ]
        }
      ]
    }
  ],
  "open_questions": [
    "YunOS 代到安卓代的确切切换年份，以及第一批安卓机型的型号清单，没查到。本轮只能把边界收窄到：海尔官网 2018-05 的 LS65AL88A71 规格页仍写「阿里YunOS」、2019-10 的 65T75 页面仍提 YunOS，而 2024 年的 43H5 / 50A20 规格页写「安卓系统」。2019-2024 之间是空白。",
    "统帅（Leader）与卡萨帝（Casarte）电视是否与海尔电视共用同一套系统和同一个 ADB 入口，仍无直接证据。本轮只查到卡萨帝电视「无 U 盘安装第三方软件」的教程（走应用商店装悟空遥控器一类工具），说明它至少和海尔电视是同一套应用生态玩法，但该帖完全不涉及 ADB；统帅没有任何专属的 ADB 资料，一条都没有。",
    "「信源 + 左左上右」与「信源 + 左左右右」两种记法哪个正确、是否按机型/年份分化——三个来源 2:1，没有本机实测可以定案。",
    "海尔机型开启 ADB 后是否弹授权确认框、是否需要 Android 11 式的无线调试配对码、端口是否为 5555：三项全部零证据（5555 是安卓默认值）。",
    "海尔预装应用包名一条都没有来源：must_keep（桌面/信号源/遥控/输入法/设置/工厂）与 junk（广告/推荐/上报/购物/演示）全部空白，广告模块的包名同样未知。要补必须有一台实机跑 pm list packages。",
    "海外/台湾海尔（LE75S8UX2、H65S900UX2 等 UX 尾缀型号）走 Google TV / Android TV，入口理应是标准安卓连点法，但本轮未验证，且不属于本条目的 region=cn 范围。",
    "社区有海尔刷机包与 root 相关讨论（电视刷机网等），本项目不采用。"
  ],
  "last_reviewed": "2026-09-15"
}
